{
  "spec_version": "0.2",
  "trace_id": "70000000000000000000000000000001",
  "run_name": "opencode:fixture-normal",
  "started_at": "2026-07-09T10:00:00.000Z",
  "ended_at": "2026-07-09T10:00:00.350Z",
  "duration_ms": 350,
  "status": "ok",
  "counts": {
    "llm_calls": 1,
    "tool_calls": 1,
    "errors": 0,
    "loop_warnings": 0
  }
}
