{
  "spec_version": "0.2.0",
  "trace_id": "30000000000000000000000000000001",
  "run_name": "ts-normal",
  "started_at": "2026-01-01T00:00:00.000Z",
  "ended_at": "2026-01-01T00:00:00.150Z",
  "duration_ms": 150,
  "status": "ok",
  "counts": {
    "llm_calls": 1,
    "tool_calls": 1,
    "errors": 0,
    "loop_warnings": 0
  }
}
