{
  "spec_version": "0.2",
  "trace_id": "10000000000000000000000000000003",
  "run_name": "golden-loop",
  "started_at": "2026-01-01T00:02:00.000000Z",
  "ended_at": "2026-01-01T00:02:00.350000Z",
  "duration_ms": 350,
  "status": "ok",
  "counts": {
    "llm_calls": 3,
    "tool_calls": 3,
    "errors": 0,
    "loop_warnings": 1
  }
}
