{
  "spec_version": "0.2",
  "trace_id": "10000000000000000000000000000002",
  "run_name": "golden-tool-call-spike",
  "started_at": "2026-01-01T00:01:00.000000Z",
  "ended_at": "2026-01-01T00:01:00.400000Z",
  "duration_ms": 400,
  "status": "ok",
  "counts": {
    "llm_calls": 1,
    "tool_calls": 4,
    "errors": 0,
    "loop_warnings": 0
  }
}
