{
  "spec_version": "0.2.0",
  "trace_id": "30000000000000000000000000000003",
  "run_name": "ts-running",
  "started_at": "2026-01-01T00:02:00.000Z",
  "ended_at": null,
  "duration_ms": null,
  "status": "running",
  "counts": {
    "llm_calls": 0,
    "tool_calls": 1,
    "errors": 0,
    "loop_warnings": 0
  }
}
