{
  "spec_version": "0.2.0",
  "trace_id": "30000000000000000000000000000002",
  "run_name": "ts-tool-loop",
  "started_at": "2026-01-01T00:01:00.000Z",
  "ended_at": "2026-01-01T00:01:00.250Z",
  "duration_ms": 250,
  "status": "ok",
  "counts": {
    "llm_calls": 0,
    "tool_calls": 3,
    "errors": 0,
    "loop_warnings": 1
  }
}
