{
  "spec_version": "0.2",
  "trace_id": "70000000000000000000000000000003",
  "run_name": "opencode:fixture-running",
  "started_at": "2026-07-09T10:02:00.000Z",
  "ended_at": null,
  "duration_ms": null,
  "status": "running",
  "counts": {
    "llm_calls": 1,
    "tool_calls": 0,
    "errors": 0,
    "loop_warnings": 0
  }
}
